{
  "title": null,
  "source_url": "https://www.youtube.com/shorts/ckSdRrgnbQI",
  "ingredients": [
    {
      "name": "cheese_plate",
      "quantity": null,
      "unit": null,
      "source": "visual",
      "confidence": 0.2390328347682953,
      "timestamps": [
        1.0
      ],
      "raw_text": null,
      "alternative_note": null
    },
    {
      "name": "cheesecake",
      "quantity": null,
      "unit": null,
      "source": "visual",
      "confidence": 0.1158524826169014,
      "timestamps": [
        1.0
      ],
      "raw_text": null,
      "alternative_note": null
    },
    {
      "name": "chicken_curry",
      "quantity": null,
      "unit": null,
      "source": "visual",
      "confidence": 0.761003851890564,
      "timestamps": [
        18.0
      ],
      "raw_text": null,
      "alternative_note": null
    },
    {
      "name": "fried_rice",
      "quantity": null,
      "unit": null,
      "source": "visual",
      "confidence": 0.11333456635475159,
      "timestamps": [
        8.0
      ],
      "raw_text": null,
      "alternative_note": null
    },
    {
      "name": "macaroni_and_cheese",
      "quantity": null,
      "unit": null,
      "source": "visual",
      "confidence": 0.10342951864004135,
      "timestamps": [
        20.0
      ],
      "raw_text": null,
      "alternative_note": null
    }
  ],
  "steps": [],
  "extraction_date": "2025-11-26T14:25:28.366064",
  "processing_time": 15.793581008911133,
  "metadata": {
    "models_used": {
      "object_detection": "yolov8n.pt",
      "ocr": "easyocr",
      "transcription": "base"
    },
    "config": {
      "fps": 1,
      "yolo_conf": 0.25
    }
  }
}