{
  "title": "Sernik baskijski. Najlepszy sernik \u015bwiata \u2728 | Rozkoszny",
  "source_url": "https://www.youtube.com/watch?v=8pBM1mcPlhg",
  "ingredients": [
    {
      "name": "apple_pie",
      "quantity": null,
      "unit": null,
      "source": "visual",
      "confidence": 0.1165798157453537,
      "timestamps": [
        2.0
      ],
      "raw_text": null,
      "alternative_note": null
    },
    {
      "name": "bread_pudding",
      "quantity": null,
      "unit": null,
      "source": "visual",
      "confidence": 0.1075756698846817,
      "timestamps": [
        449.0
      ],
      "raw_text": null,
      "alternative_note": null
    },
    {
      "name": "carrot_cake",
      "quantity": null,
      "unit": null,
      "source": "visual",
      "confidence": 0.11739709973335266,
      "timestamps": [
        572.0
      ],
      "raw_text": null,
      "alternative_note": null
    },
    {
      "name": "cheese_plate",
      "quantity": null,
      "unit": null,
      "source": "visual",
      "confidence": 0.12513837218284607,
      "timestamps": [
        224.0
      ],
      "raw_text": null,
      "alternative_note": null
    },
    {
      "name": "cheesecake",
      "quantity": null,
      "unit": null,
      "source": "visual",
      "confidence": 0.44667649269104004,
      "timestamps": [
        727.0
      ],
      "raw_text": null,
      "alternative_note": null
    },
    {
      "name": "chicken_curry",
      "quantity": null,
      "unit": null,
      "source": "visual",
      "confidence": 0.39823347330093384,
      "timestamps": [
        29.0
      ],
      "raw_text": null,
      "alternative_note": null
    },
    {
      "name": "chicken_quesadilla",
      "quantity": null,
      "unit": null,
      "source": "visual",
      "confidence": 0.24855898320674896,
      "timestamps": [
        6.0
      ],
      "raw_text": null,
      "alternative_note": null
    },
    {
      "name": "chocolate_cake",
      "quantity": null,
      "unit": null,
      "source": "visual",
      "confidence": 0.1961696892976761,
      "timestamps": [
        167.0
      ],
      "raw_text": null,
      "alternative_note": null
    },
    {
      "name": "chocolate_mousse",
      "quantity": null,
      "unit": null,
      "source": "visual",
      "confidence": 0.14414595067501068,
      "timestamps": [
        70.0
      ],
      "raw_text": null,
      "alternative_note": null
    },
    {
      "name": "french_onion_soup",
      "quantity": null,
      "unit": null,
      "source": "visual",
      "confidence": 0.10190902650356293,
      "timestamps": [
        749.0
      ],
      "raw_text": null,
      "alternative_note": null
    },
    {
      "name": "fried_rice",
      "quantity": null,
      "unit": null,
      "source": "visual",
      "confidence": 0.10963017493486404,
      "timestamps": [
        262.0
      ],
      "raw_text": null,
      "alternative_note": null
    },
    {
      "name": "garlic_bread",
      "quantity": null,
      "unit": null,
      "source": "visual",
      "confidence": 0.18825404345989227,
      "timestamps": [
        6.0
      ],
      "raw_text": null,
      "alternative_note": null
    },
    {
      "name": "grilled_cheese_sandwich",
      "quantity": null,
      "unit": null,
      "source": "visual",
      "confidence": 0.19150519371032715,
      "timestamps": [
        773.0
      ],
      "raw_text": null,
      "alternative_note": null
    },
    {
      "name": "ice_cream",
      "quantity": null,
      "unit": null,
      "source": "visual",
      "confidence": 0.6389986276626587,
      "timestamps": [
        16.0
      ],
      "raw_text": null,
      "alternative_note": null
    },
    {
      "name": "macaroni_and_cheese",
      "quantity": null,
      "unit": null,
      "source": "visual",
      "confidence": 0.13066093623638153,
      "timestamps": [
        28.0
      ],
      "raw_text": null,
      "alternative_note": null
    }
  ],
  "steps": [],
  "extraction_date": "2025-11-26T14:50:38.222767",
  "processing_time": 285.4609360694885,
  "metadata": {
    "models_used": {
      "object_detection": "yolov8n.pt",
      "ocr": "easyocr",
      "transcription": "base"
    },
    "config": {
      "fps": 1,
      "yolo_conf": 0.25
    }
  }
}